<?xml version="1.0" encoding="UTF-8"?>
<dokument
        xmlns="http://example.com/saps"
        xmlns:xsi="http://www.w3.org/2001/XMLSchema-instance"
        xsi:schemaLocation="http://example.com/saps lista_dysków.xsd">

    <nagłówek>
        <autorzy>
            <autor>
                <imię>Piotr</imię>
                <nazwisko>Stańczyk</nazwisko>
                <numer_indeksu>203999</numer_indeksu>
            </autor>
            <autor>
                <imię>Szymon</imię>
                <nazwisko>Adach</nazwisko>
                <numer_indeksu>203844</numer_indeksu>
            </autor>
        </autorzy>
        <data>2018-06-06T19:06:54.446+02:00</data>
    </nagłówek>

    <ciało>
        <lista_sklepów>
            <sklep URI="https://www.morele.net" nazwa="Morele" id="s001"/>
            <sklep nazwa="Media Markt" id="s002"/>
            <sklep nazwa="Media Expert" id="s003"/>
            <sklep nazwa="Komputronik" id="s004"/>
            <sklep nazwa="RTV Euro AGD" id="s005"/>
            <sklep nazwa="x-kom" id="s006"/>
        </lista_sklepów>
        <lista_dysków>
            <dysk typ="SSD" sklep="s001" id="d001">
                <marka>Crucial</marka>
                <model>MX200</model>
                <pojemność jednostka="GB">240</pojemność>
                <cena waluta="EUR">299.99</cena>
                <ocena>4.5</ocena>
            </dysk>
            <dysk typ="SSD" sklep="s002" id="d002">
                <marka>Micron</marka>
                <model>M1100</model>
                <pojemność jednostka="GB">250</pojemność>
                <cena waluta="PLN">249.99</cena>
                <ocena>4.5</ocena>
            </dysk>
            <dysk typ="HDD" sklep="s003" id="d003">
                <marka>Seagate</marka>
                <model>Expansion Portable</model>
                <pojemność jednostka="TB">1</pojemność>
                <cena waluta="EUR">189.99</cena>
                <ocena>4.5</ocena>
            </dysk>
            <dysk typ="SSD" sklep="s004" id="d004">
                <marka>ADATA</marka>
                <model>Ultimate SU800</model>
                <pojemność jednostka="GB">256</pojemność>
                <cena waluta="PLN">304.99</cena>
                <ocena>5.0</ocena>
            </dysk>
            <dysk typ="HDD" sklep="s004" id="d005">
                <marka>Seagate</marka>
                <model>Expansion Desktop</model>
                <pojemność jednostka="TB">2</pojemność>
                <cena waluta="PLN">254.79</cena>
                <ocena>4.5</ocena>
            </dysk>
            <dysk typ="SSD" sklep="s006" id="d006">
                <marka>Toshiba</marka>
                <model>Canvio Basics</model>
                <pojemność jednostka="TB">1</pojemność>
                <cena waluta="PLN">195.55</cena>
                <ocena>5.0</ocena>
            </dysk>
            <dysk typ="SSD" sklep="s005" id="d007">
                <marka>ADATA</marka>
                <model>Ultimate SU800</model>
                <pojemność jednostka="GB">128</pojemność>
                <cena waluta="PLN">179.88</cena>
                <ocena>5.0</ocena>
            </dysk>
            <dysk typ="SSD" sklep="s002" id="d008">
                <marka>ADATA</marka>
                <model>Ultimate SU900</model>
                <pojemność jednostka="GB">256</pojemność>
                <cena waluta="USD">379.47</cena>
                <ocena>5.0</ocena>
            </dysk>
            <dysk typ="SSD" sklep="s003" id="d009">
                <marka>GOODRAM</marka>
                <model>IRIDIUM PRO</model>
                <pojemność jednostka="GB">240</pojemność>
                <cena waluta="PLN">399.99</cena>
                <ocena>4.5</ocena>
            </dysk>
            <dysk typ="HDD" sklep="s003" id="d010">
                <marka>Seagate</marka>
                <model>Barracuda</model>
                <pojemność jednostka="TB">1</pojemność>
                <cena waluta="PLN">173.88</cena>
                <ocena>4.5</ocena>
            </dysk>
            <dysk typ="SSD" sklep="s002" id="d011">
                <marka>Samsung</marka>
                <model>850 EVO</model>
                <pojemność jednostka="GB">500</pojemność>
                <cena waluta="PLN">525.00</cena>
                <ocena>5.0</ocena>
            </dysk>
            <dysk typ="SSD" sklep="s006" id="d012">
                <marka>Samsung</marka>
                <model>850 EVO</model>
                <pojemność jednostka="GB">250</pojemność>
                <cena waluta="PLN">319.00</cena>
                <ocena>5.0</ocena>
            </dysk>
            <dysk typ="SSD" sklep="s006" id="d013">
                <marka>GOODRAM</marka>
                <model>CX300</model>
                <pojemność jednostka="GB">120</pojemność>
                <cena waluta="PLN">151.40</cena>
                <ocena>4.5</ocena>
            </dysk>
            <dysk typ="SSD" sklep="s004" id="d014">
                <marka>Samsung</marka>
                <model>960 EVO</model>
                <pojemność jednostka="GB">250</pojemność>
                <cena waluta="USD">509.00</cena>
                <ocena>5.0</ocena>
            </dysk>
            <dysk typ="SSD" sklep="s004" id="d015">
                <marka>Crucial</marka>
                <model>MX500</model>
                <pojemność jednostka="GB">250</pojemność>
                <cena waluta="PLN">309.98</cena>
                <ocena>5.0</ocena>
            </dysk>
            <dysk typ="SSD" sklep="s001" id="d016">
                <marka>Crucial</marka>
                <model>MX500</model>
                <pojemność jednostka="GB">500</pojemność>
                <cena waluta="PLN">514.54</cena>
                <ocena>5.0</ocena>
            </dysk>
            <dysk typ="HDD" sklep="s001" id="d017">
                <marka>Toshiba</marka>
                <model>P300</model>
                <pojemność jednostka="TB">1</pojemność>
                <cena waluta="PLN">154.86</cena>
                <ocena>5.0</ocena>
            </dysk>
            <dysk typ="SSD" sklep="s002" id="d018">
                <marka>GOODRAM</marka>
                <model>IRDM</model>
                <pojemność jednostka="GB">120</pojemność>
                <cena waluta="USD">174.08</cena>
                <ocena>4.5</ocena>
            </dysk>
            <dysk typ="SSD" sklep="s005" id="d019">
                <marka>GOODRAM</marka>
                <model>IRDM</model>
                <pojemność jednostka="GB">240</pojemność>
                <cena waluta="USD">298.98</cena>
                <ocena>5.0</ocena>
            </dysk>
            <dysk typ="HDD" sklep="s003" id="d020">
                <marka>WD</marka>
                <model>Elements Portable</model>
                <pojemność jednostka="TB">2</pojemność>
                <cena waluta="PLN">308.98</cena>
                <ocena>5.0</ocena>
            </dysk>
            <dysk typ="HDD" sklep="s004" id="d021">
                <marka>Maxtor</marka>
                <model>M3 Portable</model>
                <pojemność jednostka="TB">1</pojemność>
                <cena waluta="PLN">188.79</cena>
                <ocena>5.0</ocena>
            </dysk>
        </lista_dysków>
    </ciało>

</dokument>